session_pdf_url,session_year,session_date,session_pdf_text_path,session_pdf_download_status,proposal_name_from_session,proposal_gov_link,voting_details_json,session_parse_status,proposal_authors_json,proposal_document_url,proposal_document_type,proposal_document_local_path,proposal_doc_download_status,proposal_details_scrape_status,proposal_summary_general,proposal_summary_analysis,proposal_summary_fiscal_impact,proposal_summary_colloquial,proposal_category,proposal_summarize_status,proposal_approval_status,proposal_short_title,proposal_proposing_party,overall_status,last_error_message,last_processed_timestamp
https://app.parlamento.pt/WebUtils/docs/doc.pdf?Path=C5fIyISKMPEQwezB9JJ3glVFRtot%2bjYOhxP6mxJo3T8779qzR9jjMLJp6ZiZYWYROb5DA1vHQpJKv63VreyEc3tPlgX6is8eP6xxZA4L6iykNtE5pzSSJD7HJ191f18Wpcc%2f2%2futVAqwfIEgT%2bzqw1QLn9YIvrHWUgudUleBgkYOMMWMlZia%2bgL1VhP5iSr9IdUaNL2BS0laTKruuTzYVFlWt5%2bjuDDFCwguFg%2fJIjw1h5qU1Gt4dQ1GTYr8Oq7XP6JpgUaeI9QScJCfsNS0Btfsi9gGe1SgVrE9HUvC0AXBjzfNWxwXMA2OMECQLYtxoZxdQUlQ2SwxXsGN3UBzEWqu97ZSw9Dewz7oWpsg2b7VkRP%2b6ip9KsdWJmMBu%2ffAaEpM2N6ciqKzMDwSjuQd6w%3d%3d&Fich=XV_2_33_2023-12-21_ResultadoVotacoes_2023-12-21.pdf&Inline=true,2023,2023-12-21,data/session_pdfs/2023_XV_2_33_2023-12-21_ResultadoVotacoes_2023-12-21.pdf,Success,Projetos de Lei n.ºs 72/XV/1.ª (BE),https://www.parlamento.pt/ActividadeParlamentar/Paginas/DetalheIniciativa.aspx?BID=121460,"{""PS"": {""Favor"": 120, ""Contra"": 0, ""Absten\u00e7\u00e3o"": 0, ""N\u00e3o Votaram"": 0, ""TotalDeputados"": 120}, ""PSD"": {""Favor"": 0, ""Contra"": 77, ""Absten\u00e7\u00e3o"": 0, ""N\u00e3o Votaram"": 0, ""TotalDeputados"": 77}, ""CH"": {""Favor"": 0, ""Contra"": 12, ""Absten\u00e7\u00e3o"": 0, ""N\u00e3o Votaram"": 0, ""TotalDeputados"": 12}, ""IL"": {""Favor"": 0, ""Contra"": 8, ""Absten\u00e7\u00e3o"": 0, ""N\u00e3o Votaram"": 0, ""TotalDeputados"": 8}, ""PCP"": {""Favor"": 6, ""Contra"": 0, ""Absten\u00e7\u00e3o"": 0, ""N\u00e3o Votaram"": 0, ""TotalDeputados"": 6}, ""BE"": {""Favor"": 5, ""Contra"": 0, ""Absten\u00e7\u00e3o"": 0, ""N\u00e3o Votaram"": 0, ""TotalDeputados"": 5}, ""PAN"": {""Favor"": 1, ""Contra"": 0, ""Absten\u00e7\u00e3o"": 0, ""N\u00e3o Votaram"": 0, ""TotalDeputados"": 1}, ""L"": {""Favor"": 1, ""Contra"": 0, ""Absten\u00e7\u00e3o"": 0, ""N\u00e3o Votaram"": 0, ""TotalDeputados"": 1}}",Success,"[{""name"": ""Joana Mort\u00e1gua (BE)"", ""link"": ""https://www.parlamento.pt/DeputadoGP/Paginas/Biografia.aspx?BID=6063""}, {""name"": ""Pedro Filipe Soares (BE)"", ""link"": ""https://www.parlamento.pt/DeputadoGP/Paginas/Biografia.aspx?BID=3926""}, {""name"": ""Mariana Mort\u00e1gua (BE)"", ""link"": ""https://www.parlamento.pt/DeputadoGP/Paginas/Biografia.aspx?BID=4557""}, {""name"": ""Catarina Martins (BE)"", ""link"": ""https://www.parlamento.pt/DeputadoGP/Paginas/Biografia.aspx?BID=4161""}, {""name"": ""Jos\u00e9 Moura Soeiro (BE)"", ""link"": ""https://www.parlamento.pt/DeputadoGP/Paginas/Biografia.aspx?BID=2433""}]",https://app.parlamento.pt/webutils/docs/doc.pdf?path=xnnnoHMVXha2k3hmcThy8x0vMcG8gUh3taXat70y9hR%252bBTjWu0QL1e2sPy61g35KwhMb1DX%252fH09wWw1c1Y5A%252f0hSSM1ZWloLnl8k0arvGO5RAV4iWcL3fDYOpA3JWrHDXetwgmKrQ19CgXhJdpgH%252bH58rlnlWP8iPI%252f%252bNlKiExSnvn%252bqmPMFgDHggmFiM9j5jFRtT6ZPIZNebJpEOX0askg5I4UCc%252b%252fzI6fG4lMU63eN6EriAf%252b%252fDNy69kPFXlNNyGL2VOc%252bASRXHNOesc1MfQHsqxk%252fEVHPYl2RdozvSTkkUhYoYcvXGA36AW6WU5sfFfq9dqGPf0OpXIJUnxGC1%252fhz1QNuTdiPDOQzvftJsOk%253d&fich=c1f1e322-3354-41ad-97cf-aa874bb042e8.docx&Inline=true,PDF,data/proposal_docs/proposal_121460.pdf,Success,Success,"Esta proposta de lei visa proibir as chamadas ""terapias de conversão"" em Portugal, que são práticas destinadas a alterar a orientação sexual, identidade ou expressão de género de uma pessoa, sob a falsa premissa de que estas são doenças. O diploma propõe uma alteração ao Código Penal para criminalizar tais ações, impondo penas que podem incluir prisão ou multa. Distinguem-se as práticas gerais de tentativa de alteração de intervenções médico-cirúrgicas não consentidas. A proposta fundamenta-se na dignidade humana e na igualdade, argumentando que a orientação sexual e a identidade de género não são patologias e que estas ""terapias"" causam danos graves.","Os detalhes de implementação do projeto de lei alinham-se consistentemente com o objetivo declarado de proibir as ""terapias de conversão"" e proteger as pessoas LGBTIQ+. A introdução de um novo artigo (176.º-C) no Código Penal cria uma base legal explícita para a criminalização destas práticas, com gradação de penas entre esforços gerais e intervenções médico-cirúrgicas, o que é logicamente coerente com o potencial de dano. A salvaguarda que exclui procedimentos praticados no âmbito da autodeterminação da identidade de género (como cuidados de afirmação de género) é crucial e evita inconsistências, garantindo que a lei não penalize a autonomia individual. As alterações aos artigos 69.º-B e 177.º (relativos à proibição de exercício de funções e agravação de penas) complementam o novo artigo, assegurando que os agressores enfrentem as devidas consequências legais, especialmente em casos que envolvem menores ou pessoas vulneráveis. O diploma reflete um consenso científico e legislativo internacional na área.","O impacto fiscal desta proposta será provavelmente marginal. No que diz respeito às despesas governamentais, pode haver um ligeiro aumento nos custos associados à investigação, processo judicial e eventual cumprimento de penas (prisão ou vigilância) para os casos que venham a ser enquadrados por esta nova legislação. Quanto às receitas governamentais, poderá haver um aumento proveniente das multas aplicadas, embora o objetivo principal não seja a geração de receita, mas sim a dissuasão. O efeito líquido será, portanto, um aumento ligeiro e provavelmente insignificante nas despesas do Estado, dada a natureza criminal da proposta e o número esperado de casos.","Basicamente, este projeto de lei quer proibir em Portugal aquelas 'terapias' parvas que tentam 'curar' as pessoas da sua orientação sexual ou da sua identidade de género, como se isso fosse uma doença. É uma palermice que só causa sofrimento. O Bloco de Esquerda está a propor que quem ande a publicitar, promover ou a fazer estas coisas seja punido com prisão ou multa. E se forem intervenções médicas mais sérias e sem o consentimento da pessoa, a pena é bem maior. A ideia é proteger toda a gente LGBTIQ+ e garantir que ninguém seja obrigado a passar por estas torturas, que só fazem mal à cabeça e ao corpo.","[0, 3, 5]",Success,1,Proibição de Terapias de Conversão e Proteção LGBTI+,Bloco de Esquerda,Success,,2025-06-08T13:56:28.114616
https://app.parlamento.pt/WebUtils/docs/doc.pdf?Path=C5fIyISKMPEQwezB9JJ3glVFRtot%2bjYOhxP6mxJo3T8779qzR9jjMLJp6ZiZYWYROb5DA1vHQpJKv63VreyEc3tPlgX6is8eP6xxZA4L6iykNtE5pzSSJD7HJ191f18Wpcc%2f2%2futVAqwfIEgT%2bzqw1QLn9YIvrHWUgudUleBgkYOMMWMlZia%2bgL1VhP5iSr9IdUaNL2BS0laTKruuTzYVFlWt5%2bjuDDFCwguFg%2fJIjw1h5qU1Gt4dQ1GTYr8Oq7XP6JpgUaeI9QScJCfsNS0Btfsi9gGe1SgVrE9HUvC0AXBjzfNWxwXMA2OMECQLYtxoZxdQUlQ2SwxXsGN3UBzEWqu97ZSw9Dewz7oWpsg2b7VkRP%2b6ip9KsdWJmMBu%2ffAaEpM2N6ciqKzMDwSjuQd6w%3d%3d&Fich=XV_2_33_2023-12-21_ResultadoVotacoes_2023-12-21.pdf&Inline=true,2023,2023-12-21,data/session_pdfs/2023_XV_2_33_2023-12-21_ResultadoVotacoes_2023-12-21.pdf,Success,209/XV/1.ª (L),https://www.parlamento.pt/ActividadeParlamentar/Paginas/DetalheIniciativa.aspx?BID=131709,"{""PS"": {""Favor"": 120, ""Contra"": 0, ""Absten\u00e7\u00e3o"": 0, ""N\u00e3o Votaram"": 0, ""TotalDeputados"": 120}, ""PSD"": {""Favor"": 0, ""Contra"": 77, ""Absten\u00e7\u00e3o"": 0, ""N\u00e3o Votaram"": 0, ""TotalDeputados"": 77}, ""CH"": {""Favor"": 0, ""Contra"": 12, ""Absten\u00e7\u00e3o"": 0, ""N\u00e3o Votaram"": 0, ""TotalDeputados"": 12}, ""IL"": {""Favor"": 0, ""Contra"": 8, ""Absten\u00e7\u00e3o"": 0, ""N\u00e3o Votaram"": 0, ""TotalDeputados"": 8}, ""PCP"": {""Favor"": 6, ""Contra"": 0, ""Absten\u00e7\u00e3o"": 0, ""N\u00e3o Votaram"": 0, ""TotalDeputados"": 6}, ""BE"": {""Favor"": 5, ""Contra"": 0, ""Absten\u00e7\u00e3o"": 0, ""N\u00e3o Votaram"": 0, ""TotalDeputados"": 5}, ""PAN"": {""Favor"": 1, ""Contra"": 0, ""Absten\u00e7\u00e3o"": 0, ""N\u00e3o Votaram"": 0, ""TotalDeputados"": 1}, ""L"": {""Favor"": 1, ""Contra"": 0, ""Absten\u00e7\u00e3o"": 0, ""N\u00e3o Votaram"": 0, ""TotalDeputados"": 1}}",Success,"[{""name"": ""Rui Tavares (L)"", ""link"": ""https://www.parlamento.pt/DeputadoGP/Paginas/Biografia.aspx?BID=7337""}]",https://app.parlamento.pt/webutils/docs/doc.pdf?path=HdoORm3Bmg0LDlnKsRa7%252f6hriPOxclSg6VtirdUXJNE5Zu1nAb3bmMYr5uhlHxTgsx59AjSPKCWjerhI1oJgsyaBWMWFXpa40uHNvo9tZK3vY4uAIuaXsV4oQBbGljVnqBbgBc1ZPCX8mkhqcwuBtMEDqwCM6SItsrZVNbgckEIVVhybhu8HD90gZl8nISdqoeMHZK8AUug7VElrGs463WNM0lr87QTRvAa3i249jzO%252bF1wE03e244co%252bdF1SEi5jsLJkZx7EOgihaUuFUPhaYgOU9I6CdQAHrMNU4INYk%252f%252f2IhUfFNDuKFzN3RFRXpd2oANVWuVG9MrjsHQ%252bxpWtA%253d%253d&fich=e2d2d1f2-58fa-42d3-90ba-05cdcf154304.doc&Inline=true,PDF,data/proposal_docs/proposal_131709.pdf,Success,Success,"Este Projeto de Lei, proposto pelo partido LIVRE, visa proibir e criminalizar as chamadas ""práticas de conversão"" que procuram reprimir ou modificar a orientação sexual, identidade de género ou expressão de género de uma pessoa. O documento argumenta que tais práticas não têm base científica, são prejudiciais e violam os direitos fundamentais garantidos pela Constituição Portuguesa, alinhando-se com as posições de organizações internacionais como a Organização Mundial de Saúde e as Nações Unidas. A proposta altera a lei sobre a autodeterminação de género e o Código Penal para introduzir as penalizações adequadas.","O documento demonstra uma forte consistência entre os seus objetivos e os mecanismos propostos para a sua implementação. A 'Exposição de Motivos' fundamenta a necessidade da lei em princípios constitucionais de igualdade e integridade pessoal, bem como em pareceres de entidades médicas e civis que desqualificam as 'práticas de conversão' como terapêuticas. A distinção explícita de que tratamentos médicos e psicológicos consentidos para a autodeterminação de género (como terapia hormonal ou acompanhamento psicológico) não são puníveis é crucial para evitar a criminalização da prestação de cuidados de saúde legítimos e assegurar a compatibilidade com a autonomia individual. A proposta de agravamento de penas em situações de vulnerabilidade da vítima ou de danos mais graves (gravidez, lesões, suicídio) fortalece o caráter protetor da lei, visando uma implementação rigorosa contra abusos. Não se identificam inconsistências, mas sim uma clara alinhamento entre a meta de proteger os direitos humanos e a saúde das pessoas LGBTQI+ e as ferramentas legislativas para o fazer.","Estima-se que a proposta terá um impacto fiscal líquido de ligeiro aumento na despesa pública. Isso deve-se, principalmente, aos custos inerentes à investigação, processo e julgamento de novos crimes, bem como à potencial necessidade de formação para as forças de segurança, o sistema judicial e os serviços de apoio a vítimas. Não se prevê um impacto significativo nas receitas do Estado, sendo que o valor das multas aplicadas, caso existam, será provavelmente marginal em comparação com o aumento dos custos operacionais associados à aplicação da lei.","Basicamente, este projeto de lei quer acabar com as 'terapias de conversão' – aquelas tentativas de 'curar' ou 'mudar' a orientação sexual ou identidade de género de alguém. O partido LIVRE diz que isto não é ciência, que faz mal às pessoas e que é contra a nossa Constituição. A ideia é que quem tentar fazer estas práticas seja punido, mas sem confundir com o apoio médico ou psicológico que as pessoas procuram por vontade própria para a sua transição de género, por exemplo. É para proteger as pessoas LGBTQI+ e garantir que podem ser quem são sem serem forçadas a mudar.","[3, 5, 0]",Success,1,Proibição e Criminalização de Práticas de Conversão,LIVRE,Success,,2025-06-08T13:56:56.277618
https://app.parlamento.pt/WebUtils/docs/doc.pdf?Path=C5fIyISKMPEQwezB9JJ3glVFRtot%2bjYOhxP6mxJo3T8779qzR9jjMLJp6ZiZYWYROb5DA1vHQpJKv63VreyEc3tPlgX6is8eP6xxZA4L6iykNtE5pzSSJD7HJ191f18Wpcc%2f2%2futVAqwfIEgT%2bzqw1QLn9YIvrHWUgudUleBgkYOMMWMlZia%2bgL1VhP5iSr9IdUaNL2BS0laTKruuTzYVFlWt5%2bjuDDFCwguFg%2fJIjw1h5qU1Gt4dQ1GTYr8Oq7XP6JpgUaeI9QScJCfsNS0Btfsi9gGe1SgVrE9HUvC0AXBjzfNWxwXMA2OMECQLYtxoZxdQUlQ2SwxXsGN3UBzEWqu97ZSw9Dewz7oWpsg2b7VkRP%2b6ip9KsdWJmMBu%2ffAaEpM2N6ciqKzMDwSjuQd6w%3d%3d&Fich=XV_2_33_2023-12-21_ResultadoVotacoes_2023-12-21.pdf&Inline=true,2023,2023-12-21,data/session_pdfs/2023_XV_2_33_2023-12-21_ResultadoVotacoes_2023-12-21.pdf,Success,699/XV/1.ª (PAN),https://www.parlamento.pt/ActividadeParlamentar/Paginas/DetalheIniciativa.aspx?BID=152743,"{""PS"": {""Favor"": 120, ""Contra"": 0, ""Absten\u00e7\u00e3o"": 0, ""N\u00e3o Votaram"": 0, ""TotalDeputados"": 120}, ""PSD"": {""Favor"": 0, ""Contra"": 77, ""Absten\u00e7\u00e3o"": 0, ""N\u00e3o Votaram"": 0, ""TotalDeputados"": 77}, ""CH"": {""Favor"": 0, ""Contra"": 12, ""Absten\u00e7\u00e3o"": 0, ""N\u00e3o Votaram"": 0, ""TotalDeputados"": 12}, ""IL"": {""Favor"": 0, ""Contra"": 8, ""Absten\u00e7\u00e3o"": 0, ""N\u00e3o Votaram"": 0, ""TotalDeputados"": 8}, ""PCP"": {""Favor"": 6, ""Contra"": 0, ""Absten\u00e7\u00e3o"": 0, ""N\u00e3o Votaram"": 0, ""TotalDeputados"": 6}, ""BE"": {""Favor"": 5, ""Contra"": 0, ""Absten\u00e7\u00e3o"": 0, ""N\u00e3o Votaram"": 0, ""TotalDeputados"": 5}, ""PAN"": {""Favor"": 1, ""Contra"": 0, ""Absten\u00e7\u00e3o"": 0, ""N\u00e3o Votaram"": 0, ""TotalDeputados"": 1}, ""L"": {""Favor"": 1, ""Contra"": 0, ""Absten\u00e7\u00e3o"": 0, ""N\u00e3o Votaram"": 0, ""TotalDeputados"": 1}}",Success,"[{""name"": ""In\u00eas de Sousa Real (PAN)"", ""link"": ""https://www.parlamento.pt/DeputadoGP/Paginas/Biografia.aspx?BID=6864""}]",https://app.parlamento.pt/webutils/docs/doc.pdf?path=UTbLZNmtEPOkYs%252fJ%252bFk0Z330nNOL6jeUVokaeDUeCU4Z7Up7tS7euqigWED5KWGHeEKnhKSsM4oGXqCRw5GxA2HjzepN9vcFQnYJc9aN8RHrXOtda46Tpv1NPEYVgmRpxLohyl6zB3yfZQpKHVFY3%252fU3s%252bcGWzSaY0fnMWzekUs6Af6gFJ7v1lM5PZg%252fLmCV4zmrCu1pkSfAEiuoEz2MocaTDiVoLRRTH9McoiDOGb7vYsYq8Kqx47oheH4nIXDetOXGR8IGYuh9F3goBZChjfSfF09m5ctcmwultjiEjouuCr%252bglOdU9o9jd0KHzHVeyAuPowIiH%252bXqs5UUFuWsvEDacgDCXpUEhql5gI5Qb%252bEz%252f%252boPxglgtNBUchneEaRp&fich=a20bf79b-4354-41c4-8c32-cd164b00009a.docx&Inline=true,PDF,data/proposal_docs/proposal_152743.pdf,Success,Success,"A presente proposta de lei visa criminalizar as chamadas ""práticas de conversão"" que procuram alterar, limitar ou reprimir a orientação sexual ou identidade de género de uma pessoa em Portugal. A legislação introduz penas de prisão e multa para quem publicitar, promover ou praticar tais condutas, com agravamento das penas em caso de envolvimento médico ou intervenções invasivas. O projeto também estabelece a obrigatoriedade de o Governo realizar um estudo nacional sobre a dimensão e os impactos destas práticas, bem como garantir a criação de mecanismos de apoio e resposta para as vítimas. Fica expressamente salvaguardado que os procedimentos relacionados com a autodeterminação da identidade e expressão de género (como as transições de género) não são abrangidos por esta criminalização.","Esta proposta alinha-se de forma coesa com o seu objetivo de combater as práticas de conversão, consideradas prejudiciais e equiparadas a tortura por organismos internacionais. A criminalização direta destas condutas no Código Penal serve como um forte elemento dissuasor e permite a responsabilização dos perpetradores. A clareza na distinção entre as práticas de conversão (que são criminalizadas) e os processos legítimos de autodeterminação da identidade de género (que não são) é uma prova de consistência e evita a criminalização de cuidados de saúde essenciais. A inclusão da obrigatoriedade de um estudo nacional é fundamental para quantificar a verdadeira dimensão do problema em Portugal e direcionar eficazmente os recursos para os mecanismos de apoio às vítimas, garantindo que as ações futuras sejam baseadas em dados concretos. As agravações de pena em caso de danos graves ou envolvimento de menores reforçam o caráter protetor da lei. Não se identificam inconsistências na proposta, que demonstra uma abordagem abrangente e bem articulada para um problema complexo.","O impacto fiscal desta proposta será predominantemente um aumento nas despesas governamentais. A exigência de realizar um estudo nacional sobre as práticas de conversão e os seus impactos implicará custos de investigação e recolha de dados. Além disso, a garantia de ""mecanismos de apoio e resposta"" para as vítimas exigirá investimento na criação ou reforço de serviços de apoio psicológico, social e de acolhimento. Os custos com o sistema judicial e de aplicação da lei (investigação, processos, tribunais) também aumentarão devido à introdução de novas infrações criminais. Não se prevê um aumento significativo das receitas, uma vez que as multas resultantes destas condenações não constituirão uma fonte de receita substancial para o Estado. O efeito líquido será, portanto, um aumento nos gastos públicos.","Ora bem, o PAN quer que seja crime, em Portugal, quem tenta 'curar' ou 'mudar' à força a orientação sexual ou a identidade de género das pessoas, o que é uma barbaridade. Se isto for feito por médicos ou envolver coisas mais sérias como operações para mudar o corpo, a prisão é mais pesada. A ideia é proibir essas 'terapias de conversão' que só fazem mal. E o governo vai ter de investigar quantas pessoas já sofreram com isto em Portugal e, depois, criar apoios para elas. Mas atenção: isto não tem nada a ver com quem quer fazer a transição de género e mudar de corpo ou documentos, isso continua a ser um direito e é legal.","[0, 3, 5]",Success,1,Criminalização de 'terapias de conversão' e apoio a vítimas,PAN,Success,,2025-06-08T13:57:30.577898
https://app.parlamento.pt/WebUtils/docs/doc.pdf?Path=C5fIyISKMPEQwezB9JJ3glVFRtot%2bjYOhxP6mxJo3T8779qzR9jjMLJp6ZiZYWYROb5DA1vHQpJKv63VreyEc3tPlgX6is8eP6xxZA4L6iykNtE5pzSSJD7HJ191f18Wpcc%2f2%2futVAqwfIEgT%2bzqw1QLn9YIvrHWUgudUleBgkYOMMWMlZia%2bgL1VhP5iSr9IdUaNL2BS0laTKruuTzYVFlWt5%2bjuDDFCwguFg%2fJIjw1h5qU1Gt4dQ1GTYr8Oq7XP6JpgUaeI9QScJCfsNS0Btfsi9gGe1SgVrE9HUvC0AXBjzfNWxwXMA2OMECQLYtxoZxdQUlQ2SwxXsGN3UBzEWqu97ZSw9Dewz7oWpsg2b7VkRP%2b6ip9KsdWJmMBu%2ffAaEpM2N6ciqKzMDwSjuQd6w%3d%3d&Fich=XV_2_33_2023-12-21_ResultadoVotacoes_2023-12-21.pdf&Inline=true,2023,2023-12-21,data/session_pdfs/2023_XV_2_33_2023-12-21_ResultadoVotacoes_2023-12-21.pdf,Success,707/XV/1.ª (PS),https://www.parlamento.pt/ActividadeParlamentar/Paginas/DetalheIniciativa.aspx?BID=152751,"{""PS"": {""Favor"": 120, ""Contra"": 0, ""Absten\u00e7\u00e3o"": 0, ""N\u00e3o Votaram"": 0, ""TotalDeputados"": 120}, ""PSD"": {""Favor"": 0, ""Contra"": 77, ""Absten\u00e7\u00e3o"": 0, ""N\u00e3o Votaram"": 0, ""TotalDeputados"": 77}, ""CH"": {""Favor"": 0, ""Contra"": 12, ""Absten\u00e7\u00e3o"": 0, ""N\u00e3o Votaram"": 0, ""TotalDeputados"": 12}, ""IL"": {""Favor"": 0, ""Contra"": 8, ""Absten\u00e7\u00e3o"": 0, ""N\u00e3o Votaram"": 0, ""TotalDeputados"": 8}, ""PCP"": {""Favor"": 6, ""Contra"": 0, ""Absten\u00e7\u00e3o"": 0, ""N\u00e3o Votaram"": 0, ""TotalDeputados"": 6}, ""BE"": {""Favor"": 5, ""Contra"": 0, ""Absten\u00e7\u00e3o"": 0, ""N\u00e3o Votaram"": 0, ""TotalDeputados"": 5}, ""PAN"": {""Favor"": 1, ""Contra"": 0, ""Absten\u00e7\u00e3o"": 0, ""N\u00e3o Votaram"": 0, ""TotalDeputados"": 1}, ""L"": {""Favor"": 1, ""Contra"": 0, ""Absten\u00e7\u00e3o"": 0, ""N\u00e3o Votaram"": 0, ""TotalDeputados"": 1}}",Success,"[{""name"": ""Miguel dos Santos Rodrigues (PS)"", ""link"": ""https://www.parlamento.pt/DeputadoGP/Paginas/Biografia.aspx?BID=6334""}, {""name"": ""Miguel Matos (PS)"", ""link"": ""https://www.parlamento.pt/DeputadoGP/Paginas/Biografia.aspx?BID=6706""}, {""name"": ""Tiago Soares Monteiro (PS)"", ""link"": ""https://www.parlamento.pt/DeputadoGP/Paginas/Biografia.aspx?BID=7878""}, {""name"": ""Eduardo Alves (PS)"", ""link"": ""https://www.parlamento.pt/DeputadoGP/Paginas/Biografia.aspx?BID=5896""}, {""name"": ""Diogo Cunha (PS)"", ""link"": ""https://www.parlamento.pt/DeputadoGP/Paginas/Biografia.aspx?BID=7547""}, {""name"": ""B\u00e1rbara Dias (PS)"", ""link"": ""https://www.parlamento.pt/DeputadoGP/Paginas/Biografia.aspx?BID=7502""}, {""name"": ""Francisco Dinis (PS)"", ""link"": ""https://www.parlamento.pt/DeputadoGP/Paginas/Biografia.aspx?BID=7055""}, {""name"": ""Isabel Alves Moreira (PS)"", ""link"": ""https://www.parlamento.pt/DeputadoGP/Paginas/Biografia.aspx?BID=4452""}, {""name"": ""Pedro Delgado Alves (PS)"", ""link"": ""https://www.parlamento.pt/DeputadoGP/Paginas/Biografia.aspx?BID=4453""}, {""name"": ""Patr\u00edcia Faro (PS)"", ""link"": ""https://www.parlamento.pt/DeputadoGP/Paginas/Biografia.aspx?BID=6371""}, {""name"": ""Maria Begonha (PS)"", ""link"": ""https://www.parlamento.pt/DeputadoGP/Paginas/Biografia.aspx?BID=6893""}, {""name"": ""Sara Velez (PS)"", ""link"": ""https://www.parlamento.pt/DeputadoGP/Paginas/Biografia.aspx?BID=6956""}, {""name"": ""Marta Freitas (PS)"", ""link"": ""https://www.parlamento.pt/DeputadoGP/Paginas/Biografia.aspx?BID=6899""}]",https://app.parlamento.pt/webutils/docs/doc.pdf?path=RgSuSpUQ%252bJPrvlgEAlEFsE2aKdXFdX56qCN9PdKfdKJMWS9Ho%252bFVaPsRk05MEuYCiKZw2YK9Fm3BwGDyXbZiss7xMcU923BQzhIMRlw3GLpiMT3%252f4Zz0Y5wqL4HCX%252fhFSlcNQ8MTA%252b2J0feprg8kUN6d1VOFC%252bOvS%252f%252bwJUsuZwUNNV%252bH2a8yhRq1QlUt14UvSvqbtprFKmuNvpjJHW%252bAuW5Q1l3lzSNqdwnRcOYoJgPmMhuxnoMiJLWam3tr8Whz2uY7PPeXefFfZMdkb2KYJtvuvrlc5VC05m14rIhTGSobkrBtoPe9vxocrcQ%252bqDj%252blPwV8R5CQwBXsT04U%252fTV4pnGFrekjEssKku98raSYgs%253d&fich=6275bc08-78c3-4d94-8fa6-d4f217fe1909.docx&Inline=true,PDF,data/proposal_docs/proposal_152751.pdf,Success,Success,"Esta proposta de lei visa proibir as práticas conhecidas como ""terapias de conversão sexual"", que são tentativas prejudiciais de alterar a orientação sexual ou identidade de género de uma pessoa. O documento argumenta que estas práticas carecem de fundamento científico, causam danos psicológicos e físicos significativos e violam os direitos humanos. A iniciativa propõe a alteração da Lei n.º 38/2018 para proibir explicitamente tais práticas e a inclusão de um novo artigo (Artigo 176.º-C) no Código Penal, que criminaliza a promoção, facilitação ou prática destes atos. As penas incluem prisão ou multa, com agravantes para casos que envolvam menores ou pessoas particularmente vulneráveis. O objetivo é reforçar a proteção dos direitos e da dignidade das pessoas LGBT+.","O documento apresenta uma fundamentação robusta e coerente para a proibição das ""terapias de conversão"", baseando-se em vasta evidência de organizações médicas e de direitos humanos nacionais e internacionais (como a OMS, o Conselho de Direitos Humanos da ONU, a Associação Americana de Psiquiatria e a Ordem dos Psicólogos Portugueses). Estas entidades rejeitam unanimemente as ""terapias de conversão"" como ineficazes, não-científicas e profundamente danosas. As medidas propostas para a implementação – a proibição explícita na lei e a criminalização destas práticas no Código Penal – alinham-se diretamente com o objetivo de proteger os direitos humanos e a saúde das pessoas LGBT+. Não são identificadas inconsistências entre as metas declaradas e os detalhes de implementação propostos, que se focam na proteção legal e na prevenção de danos graves.","Esta proposta de lei não deverá ter um impacto fiscal direto significativo. A introdução de penalidades criminais pode implicar um ligeiro aumento nos custos associados ao sistema judicial devido a eventuais processos, mas estes deverão ser absorvidos pelos orçamentos existentes. Não são mencionadas novas despesas governamentais ou fontes de receita. O principal objetivo é de natureza legal e social, visando a proteção de direitos, não uma alteração substancial nas finanças públicas. O efeito líquido nas contas do Estado é esperado como negligenciável, embora indiretamente a melhoria da saúde e bem-estar da população LGBT+ possa gerar benefícios sociais a longo prazo.","Basicamente, esta proposta de lei quer proibir que se ""trate"" ou tente ""curar"" a orientação sexual ou identidade de género de alguém. Porquê? Porque a ciência e os médicos dizem que não há nada para curar, que não funciona e que, pior ainda, estas ""terapias"" fazem muito mal às pessoas, causando-lhes sofrimento e problemas sérios. Então, a ideia é tornar ilegal estas práticas e quem as promove ou faz pode ir para a cadeia ou pagar multas, especialmente se se aproveitarem de miúdos ou pessoas mais vulneráveis. É uma forma de garantir que toda a gente pode ser quem é, sem que ninguém tente forçar uma mudança que não faz sentido e que só prejudica.","[0, 3, 5]",Success,1,Proibição de Terapias de Conversão Sexual e de Género,Partido Socialista,Success,,2025-06-08T13:58:00.459739
