session_pdf_url,session_year,session_date,session_pdf_text_path,session_pdf_download_status,proposal_name_from_session,proposal_gov_link,voting_details_json,session_parse_status,proposal_authors_json,proposal_document_url,proposal_document_type,proposal_document_local_path,proposal_doc_download_status,proposal_details_scrape_status,proposal_summary_general,proposal_summary_analysis,proposal_summary_fiscal_impact,proposal_summary_colloquial,proposal_category,proposal_summarize_status,proposal_approval_status,proposal_short_title,proposal_proposing_party,overall_status,last_error_message,last_processed_timestamp
https://app.parlamento.pt/WebUtils/docs/doc.pdf?Path=C5fIyISKMPEQwezB9JJ3glVFRtot%2bjYOhxP6mxJo3T8779qzR9jjMLJp6ZiZYWYROb5DA1vHQpJKv63VreyEc3tPlgX6is8eP6xxZA4L6iykNtE5pzSSJD7HJ191f18Wpcc%2f2%2futVAqwfIEgT%2bzqw1QLn9YIvrHWUgudUleBgkYOMMWMlZia%2bgL1VhP5iSr9IdUaNL2BS0laTKruuTzYVFlWt5%2bjuDDFCwguFg%2fJIjw1h5qU1Gt4dQ1GTYr8Oq7XP6JpgUaeI9QScJCfsNS0Btfsi9gGe1SgVrE9HUvC0AXBjzfNWxwXMA2OMECQLYtxoZxdQUlQ2SwxXsGN3UBzEWqu97ZSw9Dewz7oWpsg2b7VkRP%2b6ip9KsdWJmMBu%2ffAaEpM2N6ciqKzMDwSjuQd6w%3d%3d&Fich=XV_2_33_2023-12-21_ResultadoVotacoes_2023-12-21.pdf&Inline=true,2023,2023-12-21,data/session_pdfs/2023_XV_2_33_2023-12-21_ResultadoVotacoes_2023-12-21.pdf,Success,Projeto de Voto n.º 540/XV/2.ª,https://www.parlamento.pt/ActividadeParlamentar/Paginas/Detalhe-Votos.aspx?BID=147470&ACT_TP=VOT,"{""PS"": {""Favor"": 0, ""Contra"": 120, ""Absten\u00e7\u00e3o"": 0, ""N\u00e3o Votaram"": 0, ""TotalDeputados"": 120}, ""PSD"": {""Favor"": 0, ""Contra"": 0, ""Absten\u00e7\u00e3o"": 77, ""N\u00e3o Votaram"": 0, ""TotalDeputados"": 77}, ""CH"": {""Favor"": 12, ""Contra"": 0, ""Absten\u00e7\u00e3o"": 0, ""N\u00e3o Votaram"": 0, ""TotalDeputados"": 12}, ""IL"": {""Favor"": 0, ""Contra"": 0, ""Absten\u00e7\u00e3o"": 0, ""N\u00e3o Votaram"": 8, ""TotalDeputados"": 8}, ""PCP"": {""Favor"": 6, ""Contra"": 0, ""Absten\u00e7\u00e3o"": 0, ""N\u00e3o Votaram"": 0, ""TotalDeputados"": 6}, ""BE"": {""Favor"": 0, ""Contra"": 5, ""Absten\u00e7\u00e3o"": 0, ""N\u00e3o Votaram"": 0, ""TotalDeputados"": 5}, ""PAN"": {""Favor"": 0, ""Contra"": 0, ""Absten\u00e7\u00e3o"": 1, ""N\u00e3o Votaram"": 0, ""TotalDeputados"": 1}, ""L"": {""Favor"": 0, ""Contra"": 5, ""Absten\u00e7\u00e3o"": 1, ""N\u00e3o Votaram"": -5, ""TotalDeputados"": 1}}",Success,,https://app.parlamento.pt/webutils/docs/doc.pdf?path=tKTRyoHLg38wQb7ONvJBynPPFq%252bEEn4ZRC%252f6oShfEj5bkDcnxxmkl2x%252fT0uAiSRe73ymvaEcg657mTIhhUjnXpCkEE1cA3XSV1bmXOJn9JHmjD%252bOl9EuijZl1UbewamnKCNEX%252fWXK4TeSKJk16o0TK14eSqyXKtu8v7RBr3k%252f%252fyKj8UmFc0xEh6eU26kkS3mL6s8Omjoco%252ftmTavcm61%252b3HMS0Ta91%252fDSM1oVmyMziANef9aZtU9KHraV8AnqYm62Yellmo0Q12Ahp%252b1ymxnOD6inv9VDSKm85QEInY80oOvpHH4KFUNLt%252f3trGUqhoK1sbaohsTntbBFLrJnqwF6EScrqMhZrMfuL1Y2I93wZ6fTQRnzW9yY%252fnbTakw9%252byD&fich=cdba685d-9727-4d57-a1ff-2445c581706c.docx&Inline=true,PDF,data/proposal_docs/proposal_147470.pdf,Success,Success,"Este documento é um ""Voto de Saudação"" da Assembleia da República que assinala o Dia Internacional das Pessoas com Deficiência. O texto reforça a importância da inclusão plena e da garantia dos direitos das pessoas com deficiência em Portugal, apelando à continuidade na criação e implementação de políticas públicas que promovam a sua integração total na sociedade. Sublinha-se a necessidade de assegurar uma vida digna e independente, afirmando que a deficiência não deve constituir um impedimento ao reconhecimento e exercício de direitos.","Este documento, sendo um ""Voto de Saudação"", não é uma proposta legislativa com detalhes de implementação ou medidas concretas. A sua natureza é de uma declaração política e de princípios, com o objetivo de expressar reconhecimento, reforçar um compromisso existente e sensibilizar para a causa da inclusão das pessoas com deficiência. Por não apresentar detalhes de implementação, não é possível analisar a sua consistência com objetivos específicos em termos práticos. No entanto, cumpre o propósito de reafirmar a adesão de Portugal aos princípios e direitos já consagrados em instrumentos internacionais, como a Convenção das Nações Unidas sobre os Direitos das Pessoas com Deficiência, e de reiterar a necessidade de continuar os esforços para eliminar obstáculos à inclusão e garantir os direitos de todos.","Como um ""Voto de Saudação"", este documento em si não tem um impacto fiscal direto imediato. Não propõe medidas orçamentais específicas que resultem em aumento ou diminuição de despesa ou receita governamental. Contudo, ao reafirmar o compromisso com a inclusão e a garantia de direitos das pessoas com deficiência, implicitamente apela à continuidade ou ao desenvolvimento de políticas públicas que, no futuro, poderão envolver custos associados, como investimentos em acessibilidade, apoio social, programas de integração ou serviços de saúde. O efeito líquido direto para o orçamento é nulo no momento da aprovação, mas o compromisso político pode influenciar despesas futuras.","Ora, isto é basicamente a Assembleia da República a dizer um grande ""Viva!"" e ""Parabéns!"" a todas as pessoas com deficiência pelo seu dia. É um documento que relembra que é super importante que toda a gente, mas mesmo toda a gente, tenha os mesmos direitos e as mesmas oportunidades, sem que a deficiência seja um entrave. É como que um ""puxão de orelhas"" para o governo e para a sociedade não esquecerem que é preciso continuar a trabalhar para que ninguém seja deixado para trás e para que todos possam ter uma vida digna e independente.","[5, 0, 3]",Success,0,Voto de Saudação: Inclusão e Direitos das Pessoas com Deficiência,,Success,,2025-06-08T13:54:53.084288
https://app.parlamento.pt/WebUtils/docs/doc.pdf?Path=C5fIyISKMPEQwezB9JJ3glVFRtot%2bjYOhxP6mxJo3T8779qzR9jjMLJp6ZiZYWYROb5DA1vHQpJKv63VreyEc3tPlgX6is8eP6xxZA4L6iykNtE5pzSSJD7HJ191f18Wpcc%2f2%2futVAqwfIEgT%2bzqw1QLn9YIvrHWUgudUleBgkYOMMWMlZia%2bgL1VhP5iSr9IdUaNL2BS0laTKruuTzYVFlWt5%2bjuDDFCwguFg%2fJIjw1h5qU1Gt4dQ1GTYr8Oq7XP6JpgUaeI9QScJCfsNS0Btfsi9gGe1SgVrE9HUvC0AXBjzfNWxwXMA2OMECQLYtxoZxdQUlQ2SwxXsGN3UBzEWqu97ZSw9Dewz7oWpsg2b7VkRP%2b6ip9KsdWJmMBu%2ffAaEpM2N6ciqKzMDwSjuQd6w%3d%3d&Fich=XV_2_33_2023-12-21_ResultadoVotacoes_2023-12-21.pdf&Inline=true,2023,2023-12-21,data/session_pdfs/2023_XV_2_33_2023-12-21_ResultadoVotacoes_2023-12-21.pdf,Success,Projeto de Lei n.º 189/XV/1.ª (CH),https://www.parlamento.pt/ActividadeParlamentar/Paginas/DetalheIniciativa.aspx?BID=131676,"{""PS"": {""Favor"": 0, ""Contra"": 120, ""Absten\u00e7\u00e3o"": 0, ""N\u00e3o Votaram"": 0, ""TotalDeputados"": 120}, ""PSD"": {""Favor"": 0, ""Contra"": 0, ""Absten\u00e7\u00e3o"": 77, ""N\u00e3o Votaram"": 0, ""TotalDeputados"": 77}, ""CH"": {""Favor"": 12, ""Contra"": 0, ""Absten\u00e7\u00e3o"": 0, ""N\u00e3o Votaram"": 0, ""TotalDeputados"": 12}, ""IL"": {""Favor"": 0, ""Contra"": 0, ""Absten\u00e7\u00e3o"": 0, ""N\u00e3o Votaram"": 8, ""TotalDeputados"": 8}, ""PCP"": {""Favor"": 6, ""Contra"": 0, ""Absten\u00e7\u00e3o"": 0, ""N\u00e3o Votaram"": 0, ""TotalDeputados"": 6}, ""BE"": {""Favor"": 0, ""Contra"": 5, ""Absten\u00e7\u00e3o"": 0, ""N\u00e3o Votaram"": 0, ""TotalDeputados"": 5}, ""PAN"": {""Favor"": 0, ""Contra"": 0, ""Absten\u00e7\u00e3o"": 1, ""N\u00e3o Votaram"": 0, ""TotalDeputados"": 1}, ""L"": {""Favor"": 0, ""Contra"": 5, ""Absten\u00e7\u00e3o"": 1, ""N\u00e3o Votaram"": -5, ""TotalDeputados"": 1}}",Success,"[{""name"": ""Andr\u00e9 Ventura (CH)"", ""link"": ""https://www.parlamento.pt/DeputadoGP/Paginas/Biografia.aspx?BID=6535""}, {""name"": ""Bruno Nunes (CH)"", ""link"": ""https://www.parlamento.pt/DeputadoGP/Paginas/Biografia.aspx?BID=7338""}, {""name"": ""Diogo Pacheco de Amorim (CH)"", ""link"": ""https://www.parlamento.pt/DeputadoGP/Paginas/Biografia.aspx?BID=6858""}, {""name"": ""Filipe Melo (CH)"", ""link"": ""https://www.parlamento.pt/DeputadoGP/Paginas/Biografia.aspx?BID=7332""}, {""name"": ""Gabriel Mith\u00e1 Ribeiro (CH)"", ""link"": ""https://www.parlamento.pt/DeputadoGP/Paginas/Biografia.aspx?BID=7340""}, {""name"": ""Jorge Galveias (CH)"", ""link"": ""https://www.parlamento.pt/DeputadoGP/Paginas/Biografia.aspx?BID=7330""}, {""name"": ""Pedro dos Santos Fraz\u00e3o (CH)"", ""link"": ""https://www.parlamento.pt/DeputadoGP/Paginas/Biografia.aspx?BID=7345""}, {""name"": ""Pedro Pessanha (CH)"", ""link"": ""https://www.parlamento.pt/DeputadoGP/Paginas/Biografia.aspx?BID=7391""}, {""name"": ""Pedro Pinto (CH)"", ""link"": ""https://www.parlamento.pt/DeputadoGP/Paginas/Biografia.aspx?BID=7336""}, {""name"": ""Rita Matias (CH)"", ""link"": ""https://www.parlamento.pt/DeputadoGP/Paginas/Biografia.aspx?BID=7390""}, {""name"": ""Rui Afonso (CH)"", ""link"": ""https://www.parlamento.pt/DeputadoGP/Paginas/Biografia.aspx?BID=7344""}, {""name"": ""Rui Paulo Sousa (CH)"", ""link"": ""https://www.parlamento.pt/DeputadoGP/Paginas/Biografia.aspx?BID=7342""}]",https://app.parlamento.pt/webutils/docs/doc.pdf?path=b0di5hZWnIf5k5sDjowc93aSfzoPtVF%252fd2%252bjDgcePntysicrAkaODre50RzOJuBbkdxY5v4sWDmofZwJLD2XFYeT88jV5B0fW2vPuNW7ivlWHoVTHVNfskwpdAcHpkN2sB%252f%252ff0217QCYfznuHnmhjFsGBo0LH8P%252bPm3i6O3nHbd3xwTxHxYWTa1NrxhWspSSpYc0QPqRNJxn%252ffYtfHp4wE4hWg9Z92KQ%252fa8FE7Cv2CFX44XCdUXnxUFIfF2%252fpLUAVjlCktaEDNpYGszXTxkUvFjmdcEa6Ou2c6qxDBfw8uTZg2FAzGYiKNBNenhExAAypnGgBduXwbLL65tcPQpmzXlVsiPJ1WvBIX4UBaS9dOqH3X57MTf2CtUVveC40Ax4&fich=a771ffb6-3338-4681-a7b9-ae9e284afbc5.doc&Inline=true,PDF,data/proposal_docs/proposal_131676.pdf,Success,Success,"A proposta visa criar um registo público e gratuito de transparência para as entidades privadas que procuram influenciar as decisões dos órgãos públicos em Portugal (atividade conhecida como ""lobbying""). O objetivo é aumentar a transparência e a responsabilidade na interação entre entidades públicas e representantes de interesses, combater a corrupção e garantir que todos os interesses legítimos sejam considerados de forma equitativa nos processos de decisão legislativa e administrativa. As entidades registadas terão direitos e deveres, incluindo a divulgação de informações sobre os seus clientes, os interesses representados, os rendimentos da atividade e a adesão a códigos de conduta.","O documento demonstra um claro alinhamento entre os objetivos de promover a transparência e combater a corrupção, e os detalhes de implementação propostos. A criação de um registo público e obrigatório para os representantes de interesses que pretendam exercer a atividade, a exigência de divulgação de informações sobre a sua atividade e rendimentos, e a previsão de códigos de conduta, são mecanismos que visam diretamente esses objetivos. A proposta também se esforça por abordar as preocupações levantadas anteriormente pelo Presidente da República aquando da devolução de uma iniciativa similar na XIII Legislatura, nomeadamente a obrigatoriedade de declaração de todos os interesses e proventos, e a inclusão da Presidência da República no âmbito da lei, o que demonstra uma tentativa de aperfeiçoamento legislativo. Uma potencial imprecisão terminológica surge entre a ""Exposição de motivos"" e os artigos da lei. A ""Exposição de motivos"" refere que o sistema de registo terá natureza ""facultativa"" (p. 3), enquanto o Artigo 12.º, n.º 2, claramente estabelece que as entidades que ""pretendam exercer a atividade de representação legítima de interesses [...] devem obrigatoriamente inscrever-se no RTRI"". A interpretação jurídica correta é que a atividade de representação de interesses é voluntária, mas, uma vez decidida a exercê-la junto das entidades públicas abrangidas, a inscrição no registo torna-se obrigatória, o que está em linha com o objetivo de transparência.","A implementação desta proposta implicará um aumento direto nas despesas governamentais. A criação e manutenção do Registo de Transparência da Representação de Interesses (RTRI) pela Assembleia da República, bem como a necessidade de outras entidades públicas criarem ou utilizarem registos próprios, exigirão investimento em infraestruturas de TI, recursos humanos para gestão, monitorização e auditoria dos dados. Além disso, as atividades de divulgação e avaliação do sistema (Artigo 14.º) também acarretarão custos administrativos. Não há indicação de aumento de receita governamental, uma vez que o registo é declarado como ""gratuito"". O efeito líquido será, portanto, um ligeiro aumento nos gastos do Estado para a prossecução de objetivos de transparência e boa governança.","Isto é uma proposta para pôr ""ordem na casa"" e acabar com as coisas ""por baixo da mesa"" em como as empresas e grupos de interesse tentam influenciar o que o governo e o parlamento decidem. Basicamente, querem que quem faz ""lobby"" (quem anda a falar com os políticos e funcionários públicos para defender os seus interesses) seja obrigado a inscrever-se numa lista pública. Assim, toda a gente pode ver quem é, o que quer, e quanto dinheiro ganha com isso. A ideia é que seja tudo às claras, para diminuir a corrupção e para que as decisões sejam feitas de forma mais justa e transparente.",[3],Success,0,Regulamentação e Transparência da Representação de Interesses (Lobbying),CHEGA,Success,,2025-06-08T13:55:26.160461
https://app.parlamento.pt/WebUtils/docs/doc.pdf?Path=C5fIyISKMPEQwezB9JJ3glVFRtot%2bjYOhxP6mxJo3T8779qzR9jjMLJp6ZiZYWYROb5DA1vHQpJKv63VreyEc3tPlgX6is8eP6xxZA4L6iykNtE5pzSSJD7HJ191f18Wpcc%2f2%2futVAqwfIEgT%2bzqw1QLn9YIvrHWUgudUleBgkYOMMWMlZia%2bgL1VhP5iSr9IdUaNL2BS0laTKruuTzYVFlWt5%2bjuDDFCwguFg%2fJIjw1h5qU1Gt4dQ1GTYr8Oq7XP6JpgUaeI9QScJCfsNS0Btfsi9gGe1SgVrE9HUvC0AXBjzfNWxwXMA2OMECQLYtxoZxdQUlQ2SwxXsGN3UBzEWqu97ZSw9Dewz7oWpsg2b7VkRP%2b6ip9KsdWJmMBu%2ffAaEpM2N6ciqKzMDwSjuQd6w%3d%3d&Fich=XV_2_33_2023-12-21_ResultadoVotacoes_2023-12-21.pdf&Inline=true,2023,2023-12-21,data/session_pdfs/2023_XV_2_33_2023-12-21_ResultadoVotacoes_2023-12-21.pdf,Success,Projeto de Resolução n.º 952/XV/2.ª (IL),https://www.parlamento.pt/ActividadeParlamentar/Paginas/DetalheIniciativa.aspx?BID=263408,"{""PS"": {""Favor"": 0, ""Contra"": 120, ""Absten\u00e7\u00e3o"": 0, ""N\u00e3o Votaram"": 0, ""TotalDeputados"": 120}, ""PSD"": {""Favor"": 77, ""Contra"": 0, ""Absten\u00e7\u00e3o"": 0, ""N\u00e3o Votaram"": 0, ""TotalDeputados"": 77}, ""CH"": {""Favor"": 12, ""Contra"": 0, ""Absten\u00e7\u00e3o"": 0, ""N\u00e3o Votaram"": 0, ""TotalDeputados"": 12}, ""IL"": {""Favor"": 8, ""Contra"": 0, ""Absten\u00e7\u00e3o"": 0, ""N\u00e3o Votaram"": 0, ""TotalDeputados"": 8}, ""PCP"": {""Favor"": 0, ""Contra"": 0, ""Absten\u00e7\u00e3o"": 6, ""N\u00e3o Votaram"": 0, ""TotalDeputados"": 6}, ""BE"": {""Favor"": 0, ""Contra"": 5, ""Absten\u00e7\u00e3o"": 0, ""N\u00e3o Votaram"": 0, ""TotalDeputados"": 5}, ""PAN"": {""Favor"": 1, ""Contra"": 0, ""Absten\u00e7\u00e3o"": 0, ""N\u00e3o Votaram"": 0, ""TotalDeputados"": 1}, ""L"": {""Favor"": 0, ""Contra"": 0, ""Absten\u00e7\u00e3o"": 1, ""N\u00e3o Votaram"": 0, ""TotalDeputados"": 1}}",Success,"[{""name"": ""Carla Castro (IL)"", ""link"": ""https://www.parlamento.pt/DeputadoGP/Paginas/Biografia.aspx?BID=6875""}, {""name"": ""Jo\u00e3o Cotrim Figueiredo (IL)"", ""link"": ""https://www.parlamento.pt/DeputadoGP/Paginas/Biografia.aspx?BID=6550""}, {""name"": ""Bernardo Blanco (IL)"", ""link"": ""https://www.parlamento.pt/DeputadoGP/Paginas/Biografia.aspx?BID=7393""}, {""name"": ""Carlos Guimar\u00e3es Pinto (IL)"", ""link"": ""https://www.parlamento.pt/DeputadoGP/Paginas/Biografia.aspx?BID=7343""}, {""name"": ""Joana Cordeiro (IL)"", ""link"": ""https://www.parlamento.pt/DeputadoGP/Paginas/Biografia.aspx?BID=7339""}, {""name"": ""Patr\u00edcia Gilvaz (IL)"", ""link"": ""https://www.parlamento.pt/DeputadoGP/Paginas/Biografia.aspx?BID=7349""}, {""name"": ""Rodrigo Saraiva (IL)"", ""link"": ""https://www.parlamento.pt/DeputadoGP/Paginas/Biografia.aspx?BID=6945""}, {""name"": ""Rui Rocha (IL)"", ""link"": ""https://www.parlamento.pt/DeputadoGP/Paginas/Biografia.aspx?BID=7331""}]",https://app.parlamento.pt/webutils/docs/doc.pdf?path=tTcp9lYDE4shokCOSnQvMJHX6e8SaSQPwJCNEBUST479PtR%252fL4TJFtDOgxvLffR1XtNttdmVj5MHxFluPtymgEdP2fCykZK2nzCj7YD6tqT5PTKDo5AwDn2NWxUVlyIq1zJCYK4LSNWqgPFt0wY63gPXgM74Sk25uA3fyjm2hklwp9z%252bjOPXD20CheIuj0MktQCtP9PX22k6lktQAiW6UjxTZg%252b3C3cVuVZXqcd7ax%252foXX2vo44zrDQ3%252bXibIPV5NrT5SG5T6qM4%252fJZiL0vv1014bliahwqRt1PQNsxsUIXjnB12OURDNvXQ1bF303p8N2RgQ%252fk%252bQFf2P8Fva6eCOUkGR50CTwVGhHYIU9xAccw%253d&fich=670a9643-aef5-4258-a4e3-73ccf0fb5c3f.docx&Inline=true,PDF,data/proposal_docs/proposal_263408.pdf,Success,Success,"Este Projeto de Resolução recomenda ao Governo Português que priorize a literacia financeira no contexto escolar. O documento sublinha a importância da autonomia e bem-estar individuais, que dependem de decisões financeiras informadas, e aponta para os baixos níveis de literacia financeira em Portugal, que diminuíram nos últimos anos. Apesar de existirem iniciativas e um plano nacional, a sua abrangência tem sido limitada. A proposta sugere a atualização do Referencial de Educação Financeira (de 2013), a inclusão explícita de aspetos elementares de literacia financeira no currículo do ensino básico para garantir que todos os alunos sejam expostos, e a integração explícita da literacia financeira nas áreas de competências do Perfil do Aluno à Saída da Escolaridade Obrigatória.","O documento identifica de forma clara e concisa um problema persistente: os baixos níveis de literacia financeira em Portugal, com base em dados concretos (inquéritos da Standard & Poor's, UE, PISA). A análise da ineficácia dos programas existentes, apesar do Plano Nacional de Formação Financeira, é pertinente e serve de justificação para as recomendações. As propostas de implementação (atualizar o referencial, integrar no currículo básico, incluir no perfil do aluno) estão diretamente alinhadas com o objetivo de melhorar a literacia financeira, visando uma abordagem mais sistemática e universal no ensino. Não se detetam inconsistências lógicas; pelo contrário, as medidas propostas abordam diretamente as falhas identificadas nas abordagens anteriores, focando-se na integração desde cedo e na obrigatoriedade da exposição a estes conhecimentos, o que é fundamental para a sua eficácia a longo prazo.","Este Projeto de Resolução é uma recomendação ao Governo, pelo que o seu impacto fiscal direto é negligenciável. Contudo, se o Governo decidir implementar as medidas propostas, é provável que haja um ligeiro aumento da despesa pública. Este aumento decorreria principalmente dos custos associados à atualização do Referencial de Educação Financeira, ao desenvolvimento de novos materiais pedagógicos e à eventual formação de professores para a correta implementação destes conteúdos no currículo. Não se prevê qualquer impacto direto no aumento da receita pública. O efeito líquido seria um pequeno aumento da despesa a curto prazo, com potenciais benefícios económicos e sociais a longo prazo (como a melhoria do bem-estar financeiro dos cidadãos, a redução da instabilidade financeira e uma maior autonomia dos indivíduos) que, embora significativos, são difíceis de quantificar como impacto fiscal direto da proposta.","Basicamente, este grupo de deputados quer que o Governo ensine melhor as crianças e jovens sobre como lidar com o dinheiro na escola. É que a malta em Portugal não percebe muito de finanças, e isso é um problema. Já existem umas iniciativas, mas não chegam a toda a gente e não estão a resultar. A ideia é que se mude o que se ensina, que seja obrigatório ter noções básicas de finanças desde o ensino mais cedo, para que todos aprendam a poupar, a investir e a tomar melhores decisões com o seu dinheiro, o que é bom para eles e para o país.","[1, 4, 5]",Success,1,Reforço da Literacia Financeira no Contexto Escolar,Iniciativa Liberal,Success,,2025-06-08T13:55:52.222997
