session_pdf_url,session_year,session_date,session_pdf_text_path,session_pdf_download_status,proposal_name_from_session,proposal_gov_link,voting_details_json,session_parse_status,proposal_authors_json,proposal_document_url,proposal_document_type,proposal_document_local_path,proposal_doc_download_status,proposal_details_scrape_status,proposal_summary_general,proposal_summary_analysis,proposal_summary_fiscal_impact,proposal_summary_colloquial,proposal_category,proposal_summarize_status,proposal_approval_status,proposal_short_title,proposal_proposing_party,overall_status,last_error_message,last_processed_timestamp
https://app.parlamento.pt/WebUtils/docs/doc.pdf?Path=C5fIyISKMPEQwezB9JJ3glVFRtot%2bjYOhxP6mxJo3T8779qzR9jjMLJp6ZiZYWYROb5DA1vHQpJKv63VreyEc3tPlgX6is8eP6xxZA4L6iykNtE5pzSSJD7HJ191f18Wpcc%2f2%2futVAqwfIEgT%2bzqw1QLn9YIvrHWUgudUleBgkYOMMWMlZia%2bgL1VhP5iSr9IdUaNL2BS0laTKruuTzYVFlWt5%2bjuDDFCwguFg%2fJIjw1h5qU1Gt4dQ1GTYr8Oq7XP6JpgUaeI9QScJCfsNS0Btfsi9gGe1SgVrE9HUvC0AXBjzfNWxwXMA2OMECQLYtxoZxdQUlQ2SwxXsGN3UBzEWqu97ZSw9Dewz7oWpsg2b7VkRP%2b6ip9KsdWJmMBu%2ffAaEpM2N6ciqKzMDwSjuQd6w%3d%3d&Fich=XV_2_33_2023-12-21_ResultadoVotacoes_2023-12-21.pdf&Inline=true,2023,2023-12-21,data/session_pdfs/2023_XV_2_33_2023-12-21_ResultadoVotacoes_2023-12-21.pdf,Success,Resolução n.º 907/XV/2.ª (BE),https://www.parlamento.pt/ActividadeParlamentar/Paginas/DetalheIniciativa.aspx?BID=243314,"{""PS"": {""Favor"": 120, ""Contra"": 0, ""Absten\u00e7\u00e3o"": 0, ""N\u00e3o Votaram"": 0, ""TotalDeputados"": 120}, ""PSD"": {""Favor"": 0, ""Contra"": 0, ""Absten\u00e7\u00e3o"": 0, ""N\u00e3o Votaram"": 77, ""TotalDeputados"": 77}, ""CH"": {""Favor"": 12, ""Contra"": 0, ""Absten\u00e7\u00e3o"": 0, ""N\u00e3o Votaram"": 0, ""TotalDeputados"": 12}, ""IL"": {""Favor"": 8, ""Contra"": 0, ""Absten\u00e7\u00e3o"": 0, ""N\u00e3o Votaram"": 0, ""TotalDeputados"": 8}, ""PCP"": {""Favor"": 0, ""Contra"": 0, ""Absten\u00e7\u00e3o"": 6, ""N\u00e3o Votaram"": 0, ""TotalDeputados"": 6}, ""BE"": {""Favor"": 0, ""Contra"": 0, ""Absten\u00e7\u00e3o"": 5, ""N\u00e3o Votaram"": 0, ""TotalDeputados"": 5}, ""PAN"": {""Favor"": 1, ""Contra"": 0, ""Absten\u00e7\u00e3o"": 0, ""N\u00e3o Votaram"": 0, ""TotalDeputados"": 1}, ""L"": {""Favor"": 1, ""Contra"": 0, ""Absten\u00e7\u00e3o"": 0, ""N\u00e3o Votaram"": 0, ""TotalDeputados"": 1}}",Success,"[{""name"": ""Isabel Pires (BE)"", ""link"": ""https://www.parlamento.pt/DeputadoGP/Paginas/Biografia.aspx?BID=5854""}, {""name"": ""Pedro Filipe Soares (BE)"", ""link"": ""https://www.parlamento.pt/DeputadoGP/Paginas/Biografia.aspx?BID=3926""}, {""name"": ""Mariana Mort\u00e1gua (BE)"", ""link"": ""https://www.parlamento.pt/DeputadoGP/Paginas/Biografia.aspx?BID=4557""}, {""name"": ""Joana Mort\u00e1gua (BE)"", ""link"": ""https://www.parlamento.pt/DeputadoGP/Paginas/Biografia.aspx?BID=6063""}, {""name"": ""Jos\u00e9 Moura Soeiro (BE)"", ""link"": ""https://www.parlamento.pt/DeputadoGP/Paginas/Biografia.aspx?BID=2433""}]",https://app.parlamento.pt/webutils/docs/doc.pdf?path=M1Y%252bN5XDhQyVLSwuIwMhlqxe%252fpN09BTsl7fy%252fRkD3jgzoTua0pDR7qeh8NXkRqWAuMmjf8QWJlIIJTxvYModw%252b69IOEf82mW4BREqmak67TXUc7NB0AOz%252bclcTj%252fIvFGYdCiEkc5lvaBRtciNOGgn8cIFJuWtx%252fcDAgq6UlxMn32BibvcqDtNmARZMqQJk2DACsicgU8iCsn%252bflrachqeLxuCIFSrSf4NgSzjN0mLo%252fJJHRzWdgbOzwXD7bPEaAljsxeAEO2cLzlW4%252bYRUt%252bYSAzd5ImBKcBqPgI6K7%252fsnxy3w3Pm7gciADp9hSRuJBQXTev%252b6L2%252biV2n8Fwb00vg6dTAYZJ3RX9rRUg2N2zqFI%253d&fich=a8ebe1a3-44b8-4239-bc5b-65a0e5796631.doc&Inline=true,PDF,data/proposal_docs/proposal_243314.pdf,Success,Success,"Esta proposta visa a realização de um novo estudo epidemiológico nacional sobre saúde mental em Portugal. O estudo anterior, publicado em 2013 e baseado em dados de 2008-2009, é considerado desatualizado e com limitações, nomeadamente quanto à identificação dos fatores sociais que influenciam a saúde mental. A iniciativa propõe que o Governo financie este novo estudo, a ser desenvolvido em colaboração com a Coordenação Nacional das Políticas de Saúde Mental e instituições de ensino superior, para atualizar os dados sobre a prevalência de perturbações psiquiátricas, o acesso a cuidados e o uso de psicofármacos, e para investigar os determinantes sociais da saúde mental na população portuguesa.","O documento estabelece claramente a necessidade de um novo estudo, sublinhando a desatualização dos dados e as lacunas do estudo anterior, especialmente no que toca aos determinantes sociais. A proposta alinha-se perfeitamente com o objetivo de aprofundar o conhecimento sobre a saúde mental em Portugal, ao propor uma metodologia colaborativa (Governo, Coordenação Nacional, ensino superior) e objetivos específicos que visam preencher as lacunas identificadas. Não se detetam inconsistências entre o propósito e os meios propostos; pelo contrário, a estrutura de implementação sugerida é lógica e adequada para alcançar os resultados pretendidos de um estudo abrangente e atualizado. A pertinência do estudo é bem justificada pela elevada prevalência de perturbações psiquiátricas e pelas dificuldades de acesso a cuidados adequados, conforme os dados alarmantes apresentados do estudo anterior.","A proposta prevê um aumento direto da despesa pública, uma vez que solicita explicitamente ao Governo que 'financie a realização de um novo estudo epidemiológico nacional de saúde mental'. Não há indicação de qualquer impacto na receita governamental. O efeito líquido imediato será, portanto, um aumento nos gastos do Estado, com um custo a ser alocado do orçamento público na área da saúde e/ou investigação.","Então, a ideia é que os dados que temos sobre a saúde mental em Portugal já são muito velhos, tipo de há 15 anos, e não nos dizem tudo o que precisamos de saber, especialmente porque tanta gente sofre. O último estudo mostrou que cá há muitos casos de ansiedade e depressão e que as pessoas demoram horrores a ter ajuda. Por isso, o Bloco de Esquerda está a propor que o governo pague um novo estudo, super completo, para percebermos bem a situação de agora, o que causa estes problemas e como podemos melhorar o apoio, tudo feito em conjunto com as universidades e as entidades da saúde.",[0],Success,1,Novo Estudo Nacional de Saúde Mental em Portugal,Bloco de Esquerda,Success,,2025-06-08T13:58:24.560362
https://app.parlamento.pt/WebUtils/docs/doc.pdf?Path=C5fIyISKMPEQwezB9JJ3glVFRtot%2bjYOhxP6mxJo3T8779qzR9jjMLJp6ZiZYWYROb5DA1vHQpJKv63VreyEc3tPlgX6is8eP6xxZA4L6iykNtE5pzSSJD7HJ191f18Wpcc%2f2%2futVAqwfIEgT%2bzqw1QLn9YIvrHWUgudUleBgkYOMMWMlZia%2bgL1VhP5iSr9IdUaNL2BS0laTKruuTzYVFlWt5%2bjuDDFCwguFg%2fJIjw1h5qU1Gt4dQ1GTYr8Oq7XP6JpgUaeI9QScJCfsNS0Btfsi9gGe1SgVrE9HUvC0AXBjzfNWxwXMA2OMECQLYtxoZxdQUlQ2SwxXsGN3UBzEWqu97ZSw9Dewz7oWpsg2b7VkRP%2b6ip9KsdWJmMBu%2ffAaEpM2N6ciqKzMDwSjuQd6w%3d%3d&Fich=XV_2_33_2023-12-21_ResultadoVotacoes_2023-12-21.pdf&Inline=true,2023,2023-12-21,data/session_pdfs/2023_XV_2_33_2023-12-21_ResultadoVotacoes_2023-12-21.pdf,Success,Projetos de Resolução n.ºs 873/XV/1.ª (PS),https://www.parlamento.pt/ActividadeParlamentar/Paginas/DetalheIniciativa.aspx?BID=233243,"{""PS"": {""Favor"": 120, ""Contra"": 0, ""Absten\u00e7\u00e3o"": 0, ""N\u00e3o Votaram"": 0, ""TotalDeputados"": 120}, ""PSD"": {""Favor"": 0, ""Contra"": 0, ""Absten\u00e7\u00e3o"": 0, ""N\u00e3o Votaram"": 77, ""TotalDeputados"": 77}, ""CH"": {""Favor"": 12, ""Contra"": 0, ""Absten\u00e7\u00e3o"": 0, ""N\u00e3o Votaram"": 0, ""TotalDeputados"": 12}, ""IL"": {""Favor"": 8, ""Contra"": 0, ""Absten\u00e7\u00e3o"": 0, ""N\u00e3o Votaram"": 0, ""TotalDeputados"": 8}, ""PCP"": {""Favor"": 0, ""Contra"": 0, ""Absten\u00e7\u00e3o"": 6, ""N\u00e3o Votaram"": 0, ""TotalDeputados"": 6}, ""BE"": {""Favor"": 0, ""Contra"": 0, ""Absten\u00e7\u00e3o"": 5, ""N\u00e3o Votaram"": 0, ""TotalDeputados"": 5}, ""PAN"": {""Favor"": 1, ""Contra"": 0, ""Absten\u00e7\u00e3o"": 0, ""N\u00e3o Votaram"": 0, ""TotalDeputados"": 1}, ""L"": {""Favor"": 1, ""Contra"": 0, ""Absten\u00e7\u00e3o"": 0, ""N\u00e3o Votaram"": 0, ""TotalDeputados"": 1}}",Success,"[{""name"": ""Miguel Matos (PS)"", ""link"": ""https://www.parlamento.pt/DeputadoGP/Paginas/Biografia.aspx?BID=6706""}, {""name"": ""Tiago Barbosa Ribeiro (PS)"", ""link"": ""https://www.parlamento.pt/DeputadoGP/Paginas/Biografia.aspx?BID=2445""}, {""name"": ""Tiago Estev\u00e3o Martins (PS)"", ""link"": ""https://www.parlamento.pt/DeputadoGP/Paginas/Biografia.aspx?BID=6949""}, {""name"": ""B\u00e1rbara Dias (PS)"", ""link"": ""https://www.parlamento.pt/DeputadoGP/Paginas/Biografia.aspx?BID=7502""}, {""name"": ""Francisco Dinis (PS)"", ""link"": ""https://www.parlamento.pt/DeputadoGP/Paginas/Biografia.aspx?BID=7055""}, {""name"": ""Susana Barroso (PS)"", ""link"": ""https://www.parlamento.pt/DeputadoGP/Paginas/Biografia.aspx?BID=7404""}, {""name"": ""Diogo Cunha (PS)"", ""link"": ""https://www.parlamento.pt/DeputadoGP/Paginas/Biografia.aspx?BID=7547""}]",https://app.parlamento.pt/webutils/docs/doc.pdf?path=QyZy4MkjKrsLr8jYUuyaCn2hbREIDTVBlbz6Xz0E2J%252fSDIy0b4F6AyCgFnw6GFOcCJG%252fIAMOkvcKaN03QFuX%252fdIszk6pwKeeYY%252b9AqWYtBKIRpw2BMfjfxes0GmYxhHMMbhxwdODSxa6g26SyX89r%252fFaSS8NLNxst%252fbbc0P%252fa%252fsvbmuvYtib%252fBKaz3clfRKimsG6yrWLPXSomWNUim78Qd5xQgNPQrBPWKxU9XRvbNZFSfoiicxDjZfCkcjDNhAasSr2yODhMwDcd2Rsbf5Azg0eeSAnqTA6rv%252b1UY%252b7r2%252fWDlWi42sdNgiQhp8hQdEZfjCMPqt60lbtgiF6a6qc4wG5goPCj%252b6ixeZn2v2XDQw%253d&fich=211dbc7e-0d7f-413c-a41e-f463d94e0345.docx&Inline=true,PDF,data/proposal_docs/proposal_233243.pdf,Success,Success,"Esta proposta governamental visa combater o elevado desemprego jovem e a baixa taxa de atividade dos estudantes em Portugal, comparativamente à média europeia. Pretende remover barreiras que dificultam a integração profissional dos estudantes-trabalhadores, assegurando que não sejam discriminados no acesso a bolsas de estudo ou apoios sociais, nomeadamente os trabalhadores independentes. A iniciativa busca também otimizar o acesso dos jovens até aos 30 anos a medidas de apoio ao primeiro emprego, mesmo que não tenham estado desempregados, e avaliar a possibilidade de diferir ou isentar contribuições para a Segurança Social e garantir o acesso à ADSE para descendentes de beneficiários que sejam estudantes-trabalhadores.","O documento identifica corretamente o problema do desemprego jovem e da baixa taxa de estudantes que trabalham em Portugal, apontando para os 'efeitos de cicatrização' no longo prazo. As recomendações propostas alinham-se de forma coerente com o objetivo de mitigar estas questões. Ao propor a não-discriminação entre trabalhadores-estudantes dependentes e independentes, a redefinição do 'primeiro emprego' para facilitar o acesso a apoios, e a avaliação de benefícios fiscais e sociais, a proposta visa remover obstáculos burocráticos e financeiros diretos à formalização do trabalho jovem e à aquisição de experiência. Não se observam inconsistências, uma vez que as medidas propostas abordam diretamente as causas identificadas para a baixa empregabilidade e atividade dos jovens.","Prevê-se um possível aumento marginal da despesa pública no curto prazo devido a um acesso mais alargado a programas de apoio ao emprego para jovens que procuram o primeiro trabalho e a uma não-exclusão de beneficiários da ADSE. Em termos de receita, o diferimento ou isenção de contribuições para a Segurança Social pode representar uma diminuição temporária. No entanto, a proposta argumenta um 'provável ganho por via da riqueza gerada pelo trabalho'. Assim, o efeito líquido a longo prazo será provavelmente positivo, uma vez que o aumento da formalização do trabalho, da empregabilidade e da atividade económica dos jovens deverá resultar num acréscimo das receitas fiscais (IRS, IVA) e contributivas, compensando os custos iniciais e gerando maior sustentabilidade económica e social.","Basicamente, este papel do Parlamento quer que o Governo ajude os jovens que estudam e trabalham, porque em Portugal ainda é muito difícil. A ideia é que não percam as bolsas se tiverem um part-time, que o Estado os ajude a encontrar o primeiro emprego mesmo que nunca tenham estado no desemprego, e que não sejam prejudicados nos impostos ou na saúde só por tentarem conciliar o estudo com o trabalho. Querem tirar-lhes os entraves para que possam ganhar experiência, o que acaba por ser bom para todos.","[1, 4, 5]",Success,1,Melhores condições de acesso ao trabalho para estudantes,Partido Socialista,Success,,2025-06-08T13:58:51.168022
https://app.parlamento.pt/WebUtils/docs/doc.pdf?Path=C5fIyISKMPEQwezB9JJ3glVFRtot%2bjYOhxP6mxJo3T8779qzR9jjMLJp6ZiZYWYROb5DA1vHQpJKv63VreyEc3tPlgX6is8eP6xxZA4L6iykNtE5pzSSJD7HJ191f18Wpcc%2f2%2futVAqwfIEgT%2bzqw1QLn9YIvrHWUgudUleBgkYOMMWMlZia%2bgL1VhP5iSr9IdUaNL2BS0laTKruuTzYVFlWt5%2bjuDDFCwguFg%2fJIjw1h5qU1Gt4dQ1GTYr8Oq7XP6JpgUaeI9QScJCfsNS0Btfsi9gGe1SgVrE9HUvC0AXBjzfNWxwXMA2OMECQLYtxoZxdQUlQ2SwxXsGN3UBzEWqu97ZSw9Dewz7oWpsg2b7VkRP%2b6ip9KsdWJmMBu%2ffAaEpM2N6ciqKzMDwSjuQd6w%3d%3d&Fich=XV_2_33_2023-12-21_ResultadoVotacoes_2023-12-21.pdf&Inline=true,2023,2023-12-21,data/session_pdfs/2023_XV_2_33_2023-12-21_ResultadoVotacoes_2023-12-21.pdf,Success,881/XV/2.ª (PAN),https://www.parlamento.pt/ActividadeParlamentar/Paginas/DetalheIniciativa.aspx?BID=233269,"{""PS"": {""Favor"": 120, ""Contra"": 0, ""Absten\u00e7\u00e3o"": 0, ""N\u00e3o Votaram"": 0, ""TotalDeputados"": 120}, ""PSD"": {""Favor"": 0, ""Contra"": 0, ""Absten\u00e7\u00e3o"": 0, ""N\u00e3o Votaram"": 77, ""TotalDeputados"": 77}, ""CH"": {""Favor"": 12, ""Contra"": 0, ""Absten\u00e7\u00e3o"": 0, ""N\u00e3o Votaram"": 0, ""TotalDeputados"": 12}, ""IL"": {""Favor"": 8, ""Contra"": 0, ""Absten\u00e7\u00e3o"": 0, ""N\u00e3o Votaram"": 0, ""TotalDeputados"": 8}, ""PCP"": {""Favor"": 0, ""Contra"": 0, ""Absten\u00e7\u00e3o"": 6, ""N\u00e3o Votaram"": 0, ""TotalDeputados"": 6}, ""BE"": {""Favor"": 0, ""Contra"": 0, ""Absten\u00e7\u00e3o"": 5, ""N\u00e3o Votaram"": 0, ""TotalDeputados"": 5}, ""PAN"": {""Favor"": 1, ""Contra"": 0, ""Absten\u00e7\u00e3o"": 0, ""N\u00e3o Votaram"": 0, ""TotalDeputados"": 1}, ""L"": {""Favor"": 1, ""Contra"": 0, ""Absten\u00e7\u00e3o"": 0, ""N\u00e3o Votaram"": 0, ""TotalDeputados"": 1}}",Success,"[{""name"": ""In\u00eas de Sousa Real (PAN)"", ""link"": ""https://www.parlamento.pt/DeputadoGP/Paginas/Biografia.aspx?BID=6864""}]",https://app.parlamento.pt/webutils/docs/doc.pdf?path=p1zKjkAUFLoT1suPtJ9THlLcXr75nSZ5Y00RxuhzX009OYH8jrsHdLGt%252bon4IHHasTpk%252faiiOOMk2%252b8yxYpWJq4ORzVbR8UT5RWQ9CHIgbTkFby%252fsDyM0HFwyODH1yhY1ZqLCq33B%252fVQQGXzhXR1cG7d9IWnJw%252bf%252b5w18LDo%252bGZNxhgP6P0qzgik8Co5SSJWfW5KWgV2UNblhdJgrBCcF4j1uLL5DNdHTeHLB4uWf2RREWu9o%252bZmOpdyBGTj2T8q2ewP7weCSfKAAS5PXQToXfdDkZO6xn77RZTxFjE%252f3UfXFniu0txasjuO0zu%252fRxz74J9O4C%252bxguhC8mfhoxBhNMOsENfb3dtcXi3P3i1uCYk%253d&fich=bdc855eb-7301-41f5-8e7c-7f3eb0adfda8.docx&Inline=true,PDF,data/proposal_docs/proposal_233269.pdf,Success,Success,"Esta proposta do partido PAN recomenda ao Governo português que adote medidas para valorizar e melhorar o estatuto do trabalhador-estudante. O objetivo é remover as barreiras legais e fiscais que atualmente dificultam a conciliação do trabalho com os estudos, levando a que Portugal tenha um número baixo de trabalhadores-estudantes comparado com a média europeia. A proposta sugere uma análise aprofundada do regime, a ponderação de isenções contributivas, a garantia de acesso a apoios sociais e de emprego, a avaliação da integração na ADSE e a análise de incentivos fiscais para empresas que apoiam a formação dos seus trabalhadores, bem como a não discriminação de trabalhadores-estudantes independentes no acesso a bolsas de estudo.","A proposta apresenta uma análise coerente e as suas recomendações alinham-se diretamente com os problemas identificados. O documento destaca, de forma consistente, as desvantagens atuais que os trabalhadores-estudantes enfrentam, como a aplicação tardia de benefícios fiscais, a exclusão de medidas de apoio ao emprego e a discriminação entre trabalhadores dependentes e independentes no acesso a bolsas e benefícios de saúde (ADSE). As propostas de resolução (estudo aprofundado, ponderação de isenções, garantia de acesso a apoios, avaliação de ADSE, análise de IRC para empresas e não discriminação) são soluções lógicas e diretas para as questões levantadas, visando derrubar as barreiras ao desenvolvimento académico e profissional destes indivíduos. Não foram identificadas inconsistências internas na argumentação.","É provável que esta proposta resulte num aumento da despesa pública e/ou numa diminuição da receita pública a curto e médio prazo. A ponderação de isenções contributivas e de incentivos fiscais para empresas poderá levar a uma redução da receita de contribuições sociais e de IRC. A potencial extensão de acesso à ADSE para mais descendentes de beneficiários e o aumento da elegibilidade para bolsas de estudo (incluindo para trabalhadores independentes) implicariam um aumento da despesa pública. O efeito líquido inicial tenderá a ser negativo para as contas públicas, embora se espere que o aumento da formalização do trabalho e da qualificação da população possa gerar benefícios económicos a longo prazo que compensem estes impactos fiscais iniciais.","Basicamente, o partido PAN está a dizer que em Portugal é chato ser trabalhador-estudante. Há pouca gente nesta situação comparado com a Europa, e isso acontece porque as regras não ajudam. Eles querem que o Governo estude a fundo como melhorar as coisas, para que estes jovens não percam os benefícios sociais ou bolsas só por trabalharem, e para que as empresas até tenham incentivos para pagar estudos aos seus funcionários. E querem acabar com a confusão de quem é trabalhador independente, para que também não sejam prejudicados. A ideia é que mais pessoas possam trabalhar e estudar ao mesmo tempo sem grandes chatices.","[0, 1, 4, 5]",Success,1,Melhorias para o Estatuto do Trabalhador-Estudante,PAN,Success,,2025-06-08T13:59:20.457206
https://app.parlamento.pt/WebUtils/docs/doc.pdf?Path=C5fIyISKMPEQwezB9JJ3glVFRtot%2bjYOhxP6mxJo3T8779qzR9jjMLJp6ZiZYWYROb5DA1vHQpJKv63VreyEc3tPlgX6is8eP6xxZA4L6iykNtE5pzSSJD7HJ191f18Wpcc%2f2%2futVAqwfIEgT%2bzqw1QLn9YIvrHWUgudUleBgkYOMMWMlZia%2bgL1VhP5iSr9IdUaNL2BS0laTKruuTzYVFlWt5%2bjuDDFCwguFg%2fJIjw1h5qU1Gt4dQ1GTYr8Oq7XP6JpgUaeI9QScJCfsNS0Btfsi9gGe1SgVrE9HUvC0AXBjzfNWxwXMA2OMECQLYtxoZxdQUlQ2SwxXsGN3UBzEWqu97ZSw9Dewz7oWpsg2b7VkRP%2b6ip9KsdWJmMBu%2ffAaEpM2N6ciqKzMDwSjuQd6w%3d%3d&Fich=XV_2_33_2023-12-21_ResultadoVotacoes_2023-12-21.pdf&Inline=true,2023,2023-12-21,data/session_pdfs/2023_XV_2_33_2023-12-21_ResultadoVotacoes_2023-12-21.pdf,Success,878/XV/1.ª (L),https://www.parlamento.pt/ActividadeParlamentar/Paginas/DetalheIniciativa.aspx?BID=233227,,Success,"[{""name"": ""Rui Tavares (L)"", ""link"": ""https://www.parlamento.pt/DeputadoGP/Paginas/Biografia.aspx?BID=7337""}]",https://app.parlamento.pt/webutils/docs/doc.pdf?path=Xu%252fTUQMNSdR7Uprk5W0%252b4UmAqpIq%252blMFNqWAxYciE03x2Xxr%252fKVnFZuoKjON0gSq9%252fmvoEWCaVUuHaiB2xAnzngw0vIlzzjc1ANkUpKyNmtFCkoxhqO9E4KAAe0RXby%252bPfdc%252byHdHc7k2fMxfpXbETdVM76SSQRyHFa%252bsZEPXcmYTyEgELssvwXk6dYL%252fzCszIqiUqp3iR49jvyihxPWDKcQ%252f1Bv8DofME3WzJb0HvEMV4Vv4XjO76wndq5xfLOUUA7S6VZmA3sbDZc%252bV%252bmdocvyknbvyMwIpJPUGRi0neUGmYbGTVccZdpKOrBf3HQgMxdQ0KbAX0Vq2crnd02ClBbfIHO8dYsuPnG4PYtCH1c%253d&fich=c208fc4b-b447-4ba2-b74c-e3f7cbcb355e.docx&Inline=true,PDF,data/proposal_docs/proposal_233227.pdf,Success,Success,"Esta proposta de lei visa criar uma linha telefónica nacional, dedicada e gratuita para a prevenção do suicídio e de comportamentos autolesivos em Portugal. Funcionará 24 horas por dia, 365 dias por ano, em todo o território nacional, incluindo as regiões autónomas. A linha será integrada no Serviço de Aconselhamento Psicológico da Linha SNS 24, mas terá um número próprio de fácil memorização. Prevê-se que o serviço seja assegurado por profissionais de saúde mental e por voluntários devidamente formados, oferecendo apoio através de voz e outras plataformas (como mensagens e chat), e com recursos para pessoas surdas (língua gestual) e falantes de línguas estrangeiras. A sua divulgação será feita anualmente através de campanhas nacionais.","O documento identifica claramente a necessidade de uma linha dedicada, gratuita e sempre disponível, em contraste com os serviços existentes que não são específicos ou imediatos o suficiente para a prevenção do suicídio e autolesão. A proposta alinha-se bem com o objetivo ao detalhar mecanismos de acessibilidade (número dedicado, 24/7, gratuito, várias plataformas, apoio linguístico) e de suporte (profissionais e voluntários formados). A integração na estrutura do SNS 24, mantendo a especificidade e um número dedicado, é um ponto forte, pois permite beneficiar da infraestrutura existente enquanto se foca na problemática específica. A previsão de mecanismos de intervisão e supervisão para a equipa sublinha a preocupação com a qualidade do apoio e o bem-estar dos profissionais/voluntários. A estratégia de divulgação anual e abrangente é essencial para garantir que a linha chega a quem dela precisa.","Esta proposta terá um impacto de aumento na despesa pública. O Artigo 5.º estabelece que a linha será financiada através de uma ""dotação orçamental anual específica e explicitamente inscrita em sede de Orçamento do Estado"". Os custos incluirão a contratação de profissionais de saúde mental, a formação e apoio a voluntários (incluindo ajudas de custo para alimentação e transporte), infraestruturas tecnológicas, e campanhas de divulgação. Não há menção de qualquer impacto que aumente a receita do governo. O efeito líquido será um aumento direto dos gastos governamentais.","Basicamente, o LIVRE quer que o governo crie um número de telefone super fácil de decorar e gratuito para toda a gente em Portugal, que esteja sempre a funcionar (24 horas por dia, todos os dias), para quem estiver a pensar em suicidar-se ou a magoar-se a si próprio. A ideia é que seja um apoio rápido e especializado, porque o que já existe não é bem para isto. Vai ter profissionais e voluntários, e também dá para falar por mensagem ou até para quem não ouve ou fala outras línguas. E sim, o Estado é que vai pagar a conta para que esta linha funcione.","[0, 5]",Success,,Linha Nacional de Prevenção do Suicídio e Comportamentos Autolesivos,LIVRE,Success,,2025-06-08T13:59:48.104791
